,title,categories,comments
130,"Our tradition once again: Last item sold in 2020, first item sold in 2021",Selling on Amazon,starting melast item sold 2020 penkovskiy paper oleg penkovskiyfirst item sold 2021 judys band bernice crawford martha millerand youlast book 2020 crippled america donald trump first book 2021 brave new world aldous huxley ironic timelast item sold shipped instruction lightkeepers great lake lighthouse keepersthen another item sold cancelled invalid delivery addressprison winner guide casino gamblingfirst item sold nationalism readerlast book edinburgh companion gaelic language first book painting sky watercolour painting tip techniqueslast 2020 thorne smith triplet nurse pushing baby pram title riding upright first 2021 go find wind triple mast sailing ship triple dj common farlast 2020 pimsleur instant conversation korean first 2021 world tier philip farmerlast 2020 kingdom kush napatan meroitic empire first f2021 say little much nursing nun hospital nineteenth century nancy texasnice hardcover paperbacki sold copy 2019 inventory year made happysallyanne paperbacklike new nancy texaswatched thread past year never participated thought always booksregardlesslast item sold birthday milestone board dog party theme product manufacture covid19 proof since people stuck animal homefirst item sold north america laminated gloss full color zone area code map think everyone planning working home 2021 winter darkness shutdown horizon note big run item last two weeksmy last sale 2020 copy playstation 2 game called flipnicand little half hour ago first sale 2021 copy nat king cole album vinylclearly christmas isnt done torturing yet play used collectible vinyl shipment guarantee qualitylast sale 2020 x ed sheeran lp first sale 2021 x ed sheeran year im going messing date next daysno kind salesone year said last purchase kind hot sauce first antidiarrhea remedy person either lollast book 2020 trail sandhill stag ernest setonthompson 1900 second printing first book 2021 cricketswell asked change new yearlast sale 2020 vintage vinyl diana ross first sale 2021 vintage vinyl peter paul maryresurgence vinyl dlast book 2020 collected story mavis gallantfirst 2021 shadow warrior os origin cia hardcover bothdont know purchase portendprobably nuthincounting 2020 category farsold 20 american history paperback usual since im history freak glad see american readingand perhaps making decision pastlast book 2020 santa book name first book 2021 bravest fish save daylast little big john crowley first english translation ugly swan arkady boris strugatsky signed hope get destination somedayamazon sale pretty pathetic last couple month last first sale baylast 2020 tube tv first 2021 broken vcr somewhat obscure kind still worth somethinglast stranger brother volume 3 dp snow first action beecher island dee brown
131,How to sue Amazon/arbitrate to get funds back,"Selling on Amazon,General Selling Questions",hi guy horrific past year lost everything suspended account ten thousand product stuck warehouse 20k withheld account 120 day account deactivation today finally received email regarding fund appeal countless attempt _ _ _the fund account disbursed final decision made reviewing information provided _ _ _ want fund released since anything pay rent food huge mistake put egg basket anyone gone path legal action please share experience better prepared conduct processi mean sound harsh forum place look advice issue qualified attorney help however read somewhere absent serious error permanently earned illegally fund obtained illegally may much recourseyou go youtube search bar site enter attorney video explaining thing happeningsounds like infringed major brand sort like popsockets like sort selling fake nikesno idea ryanmedical phone product may lucky brand come courtyou signed contract agreeing binding arbitrationespecially considering amazon personal forumseek competent legal advice arbitration going kinder towards court cost far le litigation arbitration legally binding entitled represented counsel matter attorney also easily detail concerning hold explain wise possible recoup loss andor damage competent ethical attorney charge initial consult want sure pay case legitimate chance hell want work withfor charge even 100 legally obliged represent matteramazon release inventory fund order even order nothing complainthi correct cut chase tell use exactly selling maybe someone able give better advise ill waiting hear product arei totally agree however authorized sell popsockets product applied become official distributor even never actually sold product related popsocket revenue generated listing thing submitted screenshot email letter authorization since official documentthen documentary evidence authorization grievance supplier
132,[Mod Post] Regarding the novel coronavirus (COVID-19),Selling on Amazon,possibility fba warehouse closing considered offtopic coronavirus post wowall seen people throwing rumor post reddit find far dangerous price gougingi second questionwhy many pending ordersshout guy wrapping shipment toilet paper instead bubble wrap whoever im sure regret decision tp worth productsamazons guidance san francisco bay county affected lockdown appreciateddiscussion thread indicates individual online bay area considered essential business continue make delivery doubtful address california citizen directly want information guidance please check local guideline statecan agree moreanyone else experiencing struggle trying approval new listing creation form personal safety household product anyone approved lately filled form month ago still yet confirmation denial ive several listing removed added several week ago new policy never communicated wellquick update another product flagged restricted due new policy almost year oldits forum agree let keep selling covid come topic issue selling general rant covid forum bring forum people need take breath read whats clearly op talking aboutapparently understand post introduced new policy regarding product sold certain category decide read new listing creation form required selling product catergoriesnext read question clearly pertains ability sell product selling put itapparently understand responding moderator post next look self defensive nothingcreating new thread appropriatethe bot based process detecting product full flaw vast number case open systemi agree pressure unfortunately fraud spiraled sufferinga customer stalked u found home left message home phone police felt threatening filed report yet allowed leave feedback say sold used pair sneaker tried wore tried keep saying used wasnt touching return themamazon aware filed report buyer message phone call threat etc case closed seems allowed hit good sellerswe however suffering consequence stalked threatened could keep 175 pair shoeswe need help feedback thing like buyer got extension return etc havuing trouble sure skematics algorythms could possibly account need human interventionvery good point thank youwe concerned purpose policy covid19 protect account contrary hurt accountespecially counting method odraccording policy beginning june 1 restart tracking enforcing selling account high cancellation rate late shipment rate order defect rate per established order performance standard order performance defect showing account health page prior june 1 used evaluate account healthwe understand policy intend protect account avoid affected covid19 way count total order 60 day window odr make thing became bad policy protect account contrary hurt account make account riskwhy said soodr order defect defined percentage total order given 60day periodfor odrwindow april 12 june 10 numerator 2 amazon protect policy covid19 denominator 405 odr 2405 amazon policy denominator 78 odr 278because count total order june 1so request think policy protect account affect covid19 contrary hurt accountin word temporary policy covid19 protect account account health account risk lost buy box timewe request revise mistake counting method odr intend protect account covid19 ignore defected ordersnumerator impacted covid19 reduce total ordersdenominatorif hope policy covid19that horrible im sorry family go curious though customer find house phone numberbump
133,[Mod Post] Regarding the novel coronavirus (COVID-19),Selling on Amazon,hello sellersamazon concerned impact novel coronavirus covid19 seen posted february 7we seeing increase number offtopic coronavirus post made forum please mindful refrain posting coronavirus offtopic per additional information best regard moderatorscan please define u topicis okay start thread sanitary packing technique thread safe handling buying item garage salei think ok thatthere way starting thread could offtopicsince topic hey think since main topic everyones day day conversation expected degree hope keep informed closure change going made virus help stop gossip topic conversation personally seen many warehouse closing doom gloom alarmist post appreciate post also send tremendous amount inventory hoping keep u informed change arise leave u darkso seem reasonable person lot offtopic post many thread seldom remarked upon modsit seems odd mod focus topic cv19 post offtopic post wondering roundabout way saying cv19 postswhat trying determine cv19 post permitted allthats truei understand cv19 important subject impact daily basis however seems occasionally folk offtopic cv19 thing tend occasionally ugly quickly including wildly inaccurate scientific information well comment could perceived racistwhile propagation misinformation isnt explicitly prohibited certainly helpful dangerous however insulting group people prohibitedso like said idea amazon thinking best guess might want shut thing quickly post thing go far railsor youre posting topic thread seem issue toothats kind thought mine got locked seems rule change daily maybe change according posterthank glad see part reduce panic politicization health mattershaving said costco appears limiting traditional handout sample storesnow crisisi think want u talk man trying keep u downamazon news report claim theyve cracked price gouging open thread claim otherwise might draw undue controversial attention issue solved problem need discussionmy thread locked seattle postal worker test positive coronavirus little close headquarters perhapswe long past thatamazon announced march 3rd seattle area employee tested positive virusi think topic thread locked wild speculation misinformation always appears plus topic seems bring lot aggression peopleaddressing problem solving huge way simply eliminate price gouging suspect could simple search find example minutesit attempt satire hence smiley added postsorry missed suggest sarcasm emoji lolall know wouldnt buying anything china italy south korea also like mention eventually post office close officesyou need find place ship stuff either fedx ups ip doug hefferenan somehow besides show must go oni used ship penguin zoo albany messthey also toilet paper escalates crisis viewsorry bring noticed backlog pending order account shortage hand fulfillment center look like amount order waiting fulfilled
134,Amazon marking products as expired when they are not expired,"Selling on Amazon,General Selling Questions",earlier week noticed marked three skus expired still another six month remaining shelf life product month supplywe immediately sent message support repliedjust receive email theyve initiated removal order expired product still yet hear update support three daysi cancelled removal order know timewhats deal shouldnt product sent back ship directly back fba ridiculouslooks like using rule passport office expects product 6 month shelf life product received product edge falling amount mean isnt following policy shockingat checkin fulfillment center product must remaining shelf life allows sufficient product consumed full plus additional 90 daysthis happening always problem amazon system doesnt always correct expiration date product taking 30 day send someone look actual product expiration dateimho manpower helpful bottom line perhaps thats top priorityautomatic removal order happen product unfulfillable 30 day yes weve item returned u wasnt able verify expiration date 30 day unable cancel removal orderi guess rambling today saying yes others feeling toothats bizarre part theyve unfulfillable 4 day surprised see email auto removal orderdo auto removal set le 30 day iirc settingwe received following message support 113 still multiple unit set unfulfillable due expiration date anyone suggestion next stepafter opening yet another case support total five skus assured unfulfillable expired product moved back fulfillable within 30 business dayswe also assured disposal order created meantimecan guess happened morning thats right disposal order createdthe sad part predictablebumping still inventory completely tied even create removal order addition still received inventory removal order submitted week ago infuriating
135,FBA sales notification,Selling on Amazon,week stopped getting notification product sell fba happening anyone else
136,How-to: Crossed-out price on the offer page?,Selling on Amazon,dear communityfirst happy new year everyonewe question support couldnt help u new year want raise price meantime still want use old price crossedout price indicate customer soon expect new pricewe know make change list price msrp know inventory edit see optionwe manufacturer brand owner product amazonmaybe someone know answer ive attached screenshot examplethank help take carebest regard angelo believe edit listing offer tab 12 way downyou see 3 field sale price start date end date fill listing save exit listing appear temporary sale price crossed reg pricethe display posting created going ad item putting item sale said sometimes ad display strike thru posting sometimes sale price simply placed listing likely bone bot
137,New seller--how to set sales regions,Selling on Amazon,hey new registered fee occur meet problem understand root causewhere set sale region appreciated comment advance
138,Merrell Brand - Important information about your listings on Amazon,Selling on Amazon,hiearlier today received following email amazondoes say able ungate merrell brand week using official distributor invoice need documentsthank helpdear sellerplease read email carefully listing information described may affect ability sell certain productsas part ongoing effort provide best possible customer experience implementing approval requirement merrell product shoe handbag sunglass category effective 20210108 need approval list affected product obtain approval sell product prior 20210108 listing product removed receiving message sold affected product past penalty associated action like seek approval sell affected product complete following step start application processwe appreciate cooperation important matter thank selling amazonregards servicesthat mean brand owner contacted said want manufacturer approved offering product site prove fall category simply need provide retail account invoice showing purchase directly manufacturer buying manufacturer directly sale blocked simply advanced warning happen great thanks lot
139,Why is my product not selling,Selling on Amazon,hi new selling listed first product 20 day ago seems like body really interested guy give advice make sell asin b08q5h6q1vthanksthe thing noticed incorrect english space punctuationpersonally ive never known anyone family member friend ever worn sleep mask maybe arent popular anymorethank reply sell couple hundred unit day product different color style understand whywell first need correct english bulletpoints contain improper english corrected suggestion make statement bulletpoint instead explain people want read huge block text try shorten thing bitit doesnt matter got going asking selling probably awhile getting startedclean thing hope sale launched thing take timemaybe ten thousand virtually identical sleep mask many higher rank well lot reviewsyou pick generic product private label expect sale ton competition unless invest lot money advertisingps obvious stealth incentivized review real buyer purchase personal use post photo item still package item like sleep mask something make avoid product even lower cost similar product review also left day christmas eve buyer never reviewed another product also suspiciousmanipulating review sure way suspended review obviously fake take build good metricsthere 1195 mask ranked ahead somewhere may solution
140,Green box on price on inventory management page,"Selling on Amazon,Help For New Sellers",green box inventory page charge whya green box around price indicates running sale price item selected specific period sale price valid apparently sale pricing set included free
141,Customer threatening to sue me,Selling on Amazon,item showed delivered customer claimed never got itin first message admitted package delivered side door wont themclaims told ups hundred time told sound like problem ups never got delivery instructionshe immediately leaf negative feedback complains bbb try use threat already done anyway try use leverage saying retract bbb complaint resolve issue struck feedbackhes clearly fishing refund without actually saying outright asked open case ups showed screenshots possible amazon account need contact themhe say wont help told file az loses tell try appeal say wont even talk even closed account lolat point start marking angry message response needed there obviously nothing guy im refunding failed enter delivery instruction properlyi idea denied az closed buyer account doesnt look good himanyway sent message threatening sue anybody idea expect anythingcontinue ignore sound like enough issue longer sell himah yes legal term owwwwwwignore nothing responsible mistake end proven met obligation sending item instructed find strange closed account might issue pastno stuff delivered side door legal team blusterfor close buyer account something shady long sidedoor scam work long apparently ignore unless life town take small claim court case may show closed account messaging keep wearing mouse button using response needed button message getting numerous 10 add report message button response buttonof course buyer pattern fraud abuse doesnt want customer extremely rare enjoy victory envy many dream bad customer firedbinzerif serious sidedoor nonsense second line name right deliver side door delivered rear door deliver whereveri occasionally thing like big sharpie put bold block type note carrierrear door side door etc many time people sublettingsmarter one po box street address anybody could deliver tojust chalk pandemic craziness rolloff itthere people day theyre control life theyre reaching mess people canonly update
142,Is it safe to come back yet?,"Selling on Amazon,General Selling Questions",anyone care comment current status package shipped week via carriersi say morning jan 1 im pleasantly surprised see stuck package middecember finally moving system problem package even delivered considered could much worse also customer whole understanding expected certainly wood yet expect deal late delivery claim overall im grateful result believe folk best nasty situation
143,Is it safe to come back yet?,"Selling on Amazon,General Selling Questions",yea probably got scathing email customer shame using package week 2 late proceeded capital letter demanding replacement yea noi refunded isnt amzn buyer ya product 4 ounce buck im supposed use something uspsits getting tougher tougher every day amzn ive gone vacation time head back together exactly hear back normal first week january though doubt although wish wouldi still 20 order hanging limbo right tracking update 12 week extremely frustrating ive already opened missing mail search feel like itll arrive want pointi back scrammans statement atoz opened package delivered package transit atoz immidiatley granted funded label purchased next day package delivered appeal also deniedwhats cant hear inr email coming seriously safe think child mean account 1 week atoz claim skyrocketed 0 odr 15thats j surprising expect may longerim 90 minute philly lehigh valley bad philly come philly sit lv another 2 week operating 30 staffanyway let look forward 2021 try forget 2020 ever happened still laughingfunny thing received expedited order yesterday option buy first class arriving sat jan 2nd priority mail arriving mon jan 4th thought sure ill go lower cost faster option saved screen shot page case problem lateri assumed meant showed priority mail package taking longer first class right nowi got order going hawaii last week thought never thereit book valuable could ship 1st classshipped 23rd arrived 28thmeanwhile dec 8th priority package havent scanned since 11thi two order ca nm routed puerto rico thought sure take another 2 week sorted miraculously delivered weirdyes preview trailer else caught thanks alta zenasafe nothing safe everything risk calculate risk v rewardshut salesyou decide want filing case calling 800 number waiting loooong hold annoying music last week filed case online every pkg done gotten package moving filling case include description outside package packaging type unique marking package content pkg 128 going oklahoma city tracking except pre shipment recd opened case ok sort facility supervisor emailed next morning say even recd pkg shipperi quickly wrote back explained shipper origin sort facility way overwhelmed pkgs ridirected unscanned described pkg requested help locating delivering 3 hour email found pkg facility entered scan delivered day later online case working informative ask nicely helpheres file case online scroll bottom site left side help click contact u resulting page enter tracking number directly tracking info generates something say need help package contact u started button click open box start case need fill tracking number mail class pkg type pkg content value tracking info sender address recipient address contact info submit pkg content drop category list item doesnt match predefined category select unknown explain tracking info box put detailed info tracking info box receive pkg pkg look like used priority mail branded box bstate say specific box look size shape handling instruction box fragile glass liquid temperature etc mention anything make pkg unique say example long tube wrapped brown paper priority tape priority mail fragile sticker etc description make request saying reach christmas could please locate delivered year grateful helpwe still dozen package unaccounted today gott several call email response case supervisor different destination facility saying pkease call u back want help need ask question research itemi also got call today manager local consumer affair offering help given many case openso trying everyday seeing package opened case getting deliveredso file case faster calling need bring stuck package attention go dig move alongwe starting see somewhat decent delivery time normal 710 day priority spring pandemic surge package sent week lot middle night pre dawn scan pkgs stuck early mid dec moving awfully slowly needing persistent effort track goingcovid number rising drastically winter storm lue ahead large swath country suspect bad maintain 710 day delivery grateful plan around inconsistency sudden stop movement got u picklethose u attuned andor professionally trained looking insight anothers position via body language likely lightly overlook mr bezos telltale tic closing scene trailerit interesting know whether said personal interview conducted recent testimonial appearance u house judiciary committee panelgreat answer detroit basically said full arent taking package first week december switched ups far good still getting order first week december havent arrived yet refund ask others patientyour local tv station newspaper report faster cnn share others news feed local pick sometimes go national submit story word right likely callback run storynot quiteebay forward customer tracking page show delay message carrier use theyre accommodating sellersyes ebay giving extra week filing claim allow package delivered 3 day latest estimated delivery dateanyone chicago area able provide information long currently taking new first class shipment processed chicago sort facility
