,title,categories,comments
0,"Some Key Info (ACOS, Impressions, Orders qty, CTR) are not updating on Amazon Advertising Console page","Selling on Amazon,General Selling Questions",anyone experiencing issue today ad campaign page doesnt show data acos impression ctr etc thanksyes got sameyes working last 20 hour service failing like thanksgiving
1,I have been refunding orders before customers complain or file any claim,"Selling on Amazon,Order Management, Shipping, Feedback & Returns",hey guy regard issue customer asking package wanting refund sent refund customer package week still delivered used everything central package shipped scanned desk post office rep ship date ever late end refunded people way ahead negative hit account proactive customer service understanding sort protection correct recoup loss product since went ahead refunded inr customer complaint email stuck taking loss already preparing anyway advice suggestion great even nothing done learning purpose future way ups ball everything problem reason used small first class package willing pay extra cash ups matter package point hope post office get back normal soon take care everyone happy new yearno follow correct procedure az guarantee buy coverage buyer must file claim cannotif customer contact missing package first check tracking website complete information link order appear lost open missing package claim site work notfinally think package indeed lost used buy give customer instructionto request refund eligible order 1 go order 2 locate order list click problem order 3 select package didnt arrive list 4 select request refund 5 enter comment text box 6 select submit note may require first contact wait response 48 hour eligible request refund refund request take week investigate notify decision via email address associated account view status request locate order list order page select problem order important receive maximum refund allowed need select package didnt arrivenopethis topic widely discussed recently discussed universitywhen click agree button offer item sale without actually learning platform also agree accept loss due ignoranceim checking fed exthanks responding although need smart asking question clarification forum try responding helpfulness making someone feel like inept appreciate little respect already stated prepared associated loss nothing done year unique wanted make sure miss anything regard refunding etc thanks anyway happy new yearthank figured much wanted make sure crazy year appreciate happy new yearbluntblunt word meant say topic widely discussed debated discussed university someone ignores start selling cause issueget thicker skin blunt forum comment least worriesi waiting 2nd complaint refund first usually respond standard package transit arrive later expected ty patience etc etc movement 2nd notice give refund evidently asking buyer wait date first contact filing claim demanding refundsyea pretty much exactly way handling thanks response
2,"Amazon is telling customers to request a refund, package is lost",Selling on Amazon,got back 101claims whatummmmmm package delivered lost thinkummmmm compensate package lost unless insurance every singel package insurance every packageis remedy appeal lost z claim even though used buy shipped timeummmmm newsflash priority package come 100 insurance approved two claim alreadythanks post going follow someone said received package late reminded offer prime postal system overwhelmed due pandemic answered back said arrives late money back party havent responded care money dealing legitimate lost package people lot kinder even willing wait although package saw movement weeksi willing tell file claim rude demanding also said party curious party since sell personal care product party item lol sound fun happy holiday forum people thanks venting spacekeep appealing even exhaust appeal option cant speak never lost appeal cost metric strictly follow policy lost appeal regarding premium eligibility season didnt worry itof course ive selling online since 1999 know rule protocol even constant change six claim auto granted funded delivered day granted claim appealed adding pdf proof delivery signature buyer message still lost appealswhy appeal denied reviewed available information determined provided sufficient evidence prove deliveryim surprisedwait use amazon service buy thru sell product fbm still transitthe request refundand take az claimsthen refund lost packagei package sent bought thru amazonit still transitthe customer got message saying product could lost request refund messaged take az claimi refunded toothankshurray finally made crazyyou refunded already got money fund claim buyer refunded directly youre charged determines fund claim put bill never legit atoz claim denied tracking show least carrier took possession package shipped trueif buy shipped issue refundswhatever language seems language choiceyou encounter postsi picture pushed back ol comfy recliner hazy cloud unidentifiable smoke wafting aboutgood know loli live ship package aurora il definitely feel painoh here understanding customer trained well also customized item even returnable
3,"Amazon is telling customers to request a refund, package is lost",Selling on Amazon,expedited sure lost 10 thousand dollar bet saved dozen hundred annoying buyersi even expect foot lost package bill make customer wait return anything arrives late usewe resorted routing domestic shipment china via china post seem getting customer thats basically approach toonot throw bus simply honest buyersi clearly sorry understandnot really ups fedex use last mile delivery quasi compete also work together package delivered bottom line united state enough delivery capacity certain time year 4 included needed failure optionwhere apply good keep showing receiving shelvesi product bought 10 unit send fba shipped 120320 showed 120720 distribution center 121120 show location say transit arriving late process changed since buyer receiving package ican file claim contact company bought fromsince youre posting thread everyone complaining encouraging whinyentitledpita buyer ask refund package lost simply delayed due understandable backlog patient wait package arrive like every buyeri wont lie email customer service many time help matrix time could tell wasnt real person real person helped give send detailed message daily option except help youi went preference choose longest available eliminated expedited option together issue way le still pay 3 day take week two care customer email saying estimated 14 daysyour kidding right many people give full address ship type address try correct info bob po peoria ilmany without legal address lost returned especially apartment complex miss delivered enough without last name business name problem plus without legal address postal insurance good reason contact im sure else think contacting making assumption make mean already mind made listening anything else sell handmadewrong assumption againim glad perfect issue customer addressesyou lucky person find ridiculous assumption made business customer service advised previous forum poster waste people always pick apart everything say try make look like making bad good tryi choose connected others needing critical everyone else know supportive im sorry tell know everything everything like rest u trying make lookfeel bad forum pretty tacky far forum used chase people away forumsbut maybe objectivei didnt know could actually call supportwhat numberi feel pain boat two nut job reaching facebook page saying prime day two ordered created nightmare monster ability control business u rely amazes much education everyone buyer email saying package never arrived want refund ask tracked package see usually help biti never said called opened case online option call instead email im phone person email wasas buyer feel always file claim could try itno im kidding rarely customer address incomplete ive 15 year reasonable amount business sellerfulfilled never needed contact address problemim perfect think u issue customer address buyer enter address amazon system click ship saved address place order address invalid going caught fixed right away story problem repeatedly doesnt make sensei problem apartment delivery eitheras said ive never needed contact issue like wonder need regularly rest u dontno mean im capable putting together thing say drawing conclusion themif recall youre issue complaining need amazon help offered guidance im issue need amazon help take care customer who package havent arrivedwell im glad issue amazing lucky conclusionsguidance nothing criticism judgement blame bad forum kind inputthey could place support actual information someone twist turn every word offer negative criticism insulting insinuation help anyone really hope sake new people coming help guidanceyoure foolish think guess youve got silly excuse 100 like response got mean advice meaningless unhelpful nothing criticismwell 100 user liked response funny doesnt see thatbut hey christmas ill leave advice open mind accept merit reject see fit help business better anyone else including initial response meant criticize help open eye fact view entity empowered control fate youll lot le problem lot successseller support also stated u refund good returned customer demanding refund even delivers hundred happened sure address situation bad feedback starting come inhelp put something 3rd party world stating carrier fault 3rd party reliable package carrier deliverif used buy neg feedback related complaint struckthrough note delivery issue order mot fault sellerthat may support provides issue
4,"Amazon is telling customers to request a refund, package is lost",Selling on Amazon,ups fedex also struggling make delivery stopped taking delivery retailer routed package strained postal service clearly hurting though multitude reasons your comment suggest arent exactly following whats going ill leave isolated experience represent happening larger scale respectfully please reading may gain better understandingdid file claimsmy ups package delayed day two best delayed alli file claim right already miserable put christmas smile good dad ruined christmas doesnt ruin kid christmas 2021 change far past done business even funnythis experience ups delivering 1 day normal 1 day zone 2 day 2 day zone etcwhat really make blood boil local post office branch delivering priority mail package package christmas day meanwhile many small business shipped item fcm shaft part reason permitted enter nsa negotiated service agreement small businessesmy personal experience ups also bad point unprecedented carrier experiencing issue others taking brunt hit variety reasonsmaybe united state postal service commercial carrier business stick first class letter leave cartage parcel professionalsyes ups fedex saying decade caveat require u handle rural delivery profitable thing airline tried deregulated airline industry going say let post office go place profitable like regular carrier way u cite subsidizing rural route postage fee sarcasmfunny ups add rural surcharge remote location shipment instance doubled costi rural might profitable also know individual extremely remote area option setting private box local tavern coop gas station etc already postal service doesnt even provide front door delivery rural area right nowthe le 1 population affect need work around like already many thing like running water electricity advantage disadvantage nearest neighbor 10 mile closest grocer 75 mile away houseit way 1 looking profitability ups fedex rely much last mile service rural area let forget truck still go letter serviceto fair last mile service always economical ups fedex federal government unfair competitive advantage doesnt pay income tax right least 16 45 increase operating cost federal government also doesnt pay road use tax fuel make every gallon fuel 0244 cheaper including state fuel tax 11 reduction fuel cost equates eight mile gallon competitive advantage 305 per 100 mile fuel expenditure alonei issue exempting carrier state federal highway use fuel tax exchange downsizing exclusively firstclass letter service huge bonus bulk mail rate ie junk mailnot everything competition thing done public good profitsi issue reason ups subsidized form fuel tax reduction cement mixer next road pay tax use road like going carrying mail parcel subsidizing shipment gas tax road associated tax common good interstate commerce national defense post office serf purpose ups exists make profit serve interest american leader elected representative remove ceo private corporation like board governor postmaster general reconsiderremember email got recently thanking u working hard much love u someone corporate writing small medium glorified thrown street roller az claim instantly granted appeal never work ya mean much _if go operates horribly ups fedex stand make billion never help themi mind return well since customer keep problem instantly granting az claim package still transit clearly lost customer going try keep product money fault owni agree believe law keep item refundim waiting really shocked hasnt made announcement regarding handle however refunding az claim funding anything think rather customer get keep item return coming amazon pocketi selling 18 year usually pretty quick well within day update u handling assume overwhelmed believe feeling 100xs worst im sure put notice new alert soon hopethe issue funding pocket well take 001 workforce 5 minute 1 update u handling 2 notify customer ongoing national international issue instead telling ask refundsit completely unacceptable well aware happening almost 3 week take 3 week 4 week mass carrier delay even give kind announcement buyer something else wrong obviously choose push onto u deal financially emotionally customer instead making simple easy decision educate buyer current issue may affecting ordersliterally super easy asking much really wanted almost late make difference package bound make next week shopping virtually stop weekmy local po pick scan sheet doesnt count shipped hit pittsburgh center real delay however due pandemic combined year 23 day lag especially weekend picked actually classifies shipped using way justify reimbursing buyer pocket rightthere excuse make adjustment due issue hand especially continue promote priority mail valid option even sfp two day kidding thankfully story picking steam feel made whole already stopped using priority mail 10 day ago paying extra 15 per shipment avoid wheres stuff yet continues promote priority mail sfp two day orderswe already paying extra satisfy buyer yet say nothing excusethe system block customer opt getting reply question opt know sell obviously need contact customer order fulfill order info need item purchased available product page buyer review placing order unless possibly youre handmade item customized individual buyersi sell area cant speak handle havent given indication recall handmade item purchase handsoff transaction need contact buyer allof course realize work person may work another wringing hand complaining need take action nothing yourselftheres lot thats wrong lot many time mitigate impact amazon failure customer servicethats big difference u apparently almost contact amazonwhen buyer message u say package lost refunded part ive told themin every case best throw bus u imo clear telling buyer truth avoid payout az claim buy policy regardless im finding buyer patient understanding also direct tracking link since lag behind tracking event fails provide detailed informationthe last buyer sent told lost message two day ago package delivered today lost buyer sent lostrefund message three day ago picked package yesterdaynever miss opportunity politely inform buyer full poo poo
5,"Amazon is telling customers to request a refund, package is lost",Selling on Amazon,denying claim using excuse package shipped late scanning using excuse find 15 claim shipped obvious package leave pa first scan 10 day later florida didnt ship package late florida denying claim refunding stop bleed odr outrageoususps deserves dissolved financial loss many u take beyond expectedwe well beyond another 15 z granted initial scan somewhere even near located saying shipped late guessing thats answer going see claim held selleryes thats new reason grant z hold everything shipped yeah scanning small first class 15 making driver scan front u told give package carrier scan pick previously picked large box truck taken directly distribution cnter often scan werent seen day never issue package arrived initial scan never mattered carrier ready bust button he happy initial scan see nothing else day excuse tell u shipped late true ups never problemnot hurting burdening system struggling need addressed walmart marketplace temporarily shield let customer know issue transit process 0 control overyou clearly understand happening every order order delivered show 30 example customer last week personal experience youd likethats im far worked people youre always going hateful angry people god deal themnot long ago discussion forum regarding necessary insist employee scan parcel scan sheet immediately many claimed wasnt necessary anyone waste aggravate postal service employee insisting scan happen pickupdropoff presence stupid andor nastyanyone else recall light recent event agree always insist seeing parcel scan sheet scanned pickup dropoffwere little grand refund give due failing scan 55 incorrectly granted atozs appealing course number could absolutely swing another thousand late november shipment havent really combed yet people supposed looked number item showing scan first week december yes scan sheet im counting lucky star havent lost money holiday season havent made enough money make stressinducing nightmare worth far arent going backwardsof course going money soon hopefully worth ignore u thousand little guy fail follow policy called cant wait story next year appears almost entirely scammer think ordered medicine legitimate company think forced thing right go look partner hold end bargainyou guy start filing claim approving rather quicklythis postal worker fault pandemic ecommerce spike highest level incompetence management level using post office next christmas dropped 20 tub mail day local post office loading dock come find didnt scan sheet customer think printed label didnt even ship item top tell customer scan sheet received shipment maybe package customer think liar thief best christmas record sale turning nightmare call 911 thought good point even care money anymore want overwe demanding carrier scan front u refusing giving le 10 package day 100 told u take carrier much scanned distribution center fine case scan happens within 48 hour notweve moved mostly everything ups smaller package 1 pound giving le 200 day care lose much else take post office area leave pre posted package claim scan end day thats best optionthis new excuse choice pay z claim hold accountable 15 claim delivered right received payment appealing understanding reviewer young people usa wondering idea happening appeal deny always reason didnt ship yes exhaustingnot every issue fault read post cant even buyer address correction need use privilege respond every customer email never ignored email lucky inquires getting 20 every day well week many order shipped dec 2nd delivered friday blame asking blocking many many email ive called numerous time address issue getting customer response im told opted even first email thing may vary many item sellship work many working someone elsebelieve ive spent hour contacting info regarding order customer confusion unable info need item purchased also tell email customer since opted outluckily customer understanding know going post office hub nationwide mean living rock news rochester ny hub hundred trailer unsorted mail sitting outside hub space move worker sort couldnt even enough seasonal help american lazy give unemployment hard work offering carrier clerk overtime come sorting center help told clerk make idiot post office scan every package 20 tub individually tell file complaint post master least customer know place blameperhaps make argument management particular facility take accountability package scannedbut happening right absolutely fault pandemic surge online purchase along postmaster general systemhad done back november situation feel right picked tractor trailer every day past 3 year never issue scan everything arrived scan issue becoming issue z gratned immediately telling u didnt ship package 2 week yesterday carrier refused scan sent employee local office end day told leave open window scan end day went 3 made sure scanned insane come im really shocked using excuse pay claim well knowing item left many point deliver 5 appealing delivered day claim granted make wonder lot fo buyer tooseeing delivery imminent file claim get money package deliverswe know restif case ups fed ex issue zero problem getting package early ups ground pa ny day december pa ny medium mail three week nothing sitting hub post office blaming pandemic ecommerce sale bsamazon never acknowledge problem dirt perfect universe every us fba site every gone make mistake master plan bet life itim shocked bet still many setting 1 day handling 24 day transit amazon exposure many many million cover claim fully expected use narrowest restrictive interpretation buy policy refund order quickly changed handling 10 day maxed transit 58 day package leave possessionpresence without scanned either warehouse po feeling enough set inventory 0 ride outthose considering arbitration make sure fine folk take screenshots amazon transit setting environment max permit low imo influence buyer expectation increase likelihood az claim making culpablei november stuck regional hub mostly orlando letter carrier told backlog nightmarish proportion
6,"Amazon is telling customers to request a refund, package is lost",Selling on Amazon,even accepting scanned package saying ship timely matter forget policynot true case appealed lost even though buy used item show accepted replied back saying ship timely matter item shipped 7th day ordered amazon big powerful care anyone u little bit huge many could give hoot loose could helped situation began saw issue coming long ago see article washington postwhich month ago stating going issuein end drunk cool aid late king must bowthis christmas delema small mom pop store going hurt maybe even bankrupt worst second wave pandemic hittingwell done well played reign supreme hail hail hail bowthanks purchased servicesand filed missing mail report item shipped december 04 tracking event since initial tracking poi shocked receive following reply hour laterthis declaring package lost le three week wonder quick package insured wasntbtw day later subsequent tracking event still close buyer least lostlook policy information make adjustment along handling time give customer everything need room back check company policy page example working u change handling time based reserve account release almost daily ensure people item expected adn explain holiday delay also confirm receive order everyone appreciates follow email explaining handling time delay receive fewer order customer much delighted hope help someoneit appears infectious disease cause package incorrectly scanned reached ups never thought custom clearance go 40 mile state lol must union employee oversized paycheck harumph harumph harumph loli told question dumb send note buyersdont think could way add note email sends purchase use always ebay holiday thing could effect delivery far know way unless email every customer something missed sending individual email waste really think blockedi cant even response needing address infofor seems like priority flat rate envelope taking longest first class priority packagesif file clam add postage claim 5 claim previous year filed added postage right claim put yesterday day still review feel like really need held accountable disasterthe thought police appreciate file name uploaded imagehowever made laughya gee thanks pointing outso check order shipped 3 day ago scheduled delivered tomorrow ill keeping eye see actually happensi spoke mail carrier today said distribution center getting new package shipped right leaving one week instead firstin firstout lastin first make sense right make sense waste labor touching everything multiple time due geographic location cant rake leaf bottom pile firstok maybe make sense fair people waiting week packagestriage fairness survivalhow much people refund far 250592 far going daily probably bankruptcy us12 single az claim im going appeal basis using amazon buy shippingwhat customer inquiry refunded late package thanks amazon misguided noteof inquiry ive ultimately went file az claim item received message sent need refund othersif ability contact customer perhaps misused contact customer want usually need wouldnt suggest pester customer proactively unnecessary message buyer concerned package reach ask send message recommended providing little bit customer service avoid least minimize disastrous consequence people worried aboutonly delivered otherwise hook unfortunately
